{
	"$schema": "../../kit/schema/site-1.json",
	"site": 1,
	"project": "fixture-app",
	"basePath": "/fixture-app/docs",
	"themeClass": "app-fixture",
	"navLabel": {
		"en": "Docs",
		"zh": "文档",
		"ar": "التوثيق",
		"es": "Documentación",
		"ja": "ドキュメント",
		"fr": "Documentation",
		"pt-BR": "Documentação"
	},
	"versions": [
		{
			"label": "1.1.0",
			"commit": "54ce86a3b69d49475fdb30d20499cc2b48c14cb1",
			"released": "2026-04-08",
			"default": true,
			"digest": "3f1c0a2b9d4e5f60718293a4b5c6d7e8f90a1b2c3d4e5f60718293a4b5c6d7e8"
		},
		{
			"label": "1.0.0",
			"commit": "bec42b4a2f4d59371ae29e19d9e8b441165b186b",
			"released": "2026-01-12"
		}
	],
	"hidden": ["reference/api"],
	"redirects": {
		"first-tag": "guide/first-tag"
	},
	"pages": [
		"index",
		"guide/index",
		"guide/first-tag",
		"guide/troubleshooting",
		"reference/index",
		"reference/chip-support",
		"reference/api",
		"developer/architecture"
	]
}
